{
  "schema_version": "1.0",
  "review_id": "DF4C-DEMO-REVIEW",
  "supervisory_run_id": "DF4C-DEMO",
  "parent_milestone": "Fictional documentation consolidation",
  "parent_objective": "Review three isolated documentation workers.",
  "approved_branch": "customer-management-v1",
  "approved_starting_sha": "8e431eab4e56888b82bc177133bddaa020fda210",
  "supervisory_contract_digest": "0000000000000000000000000000000000000000000000000000000000000000",
  "included_worker_records": [],
  "excluded_or_missing_workers": ["DOC-A", "DOC-B", "DOC-C"],
  "execution_waves": [["DOC-A", "DOC-B"], ["DOC-C"]],
  "dependency_status": [],
  "worker_reviews": [],
  "workspace_provenance_findings": [],
  "verified_changed_file_summaries": [],
  "file_conflicts": [],
  "resource_conflicts": [],
  "migration_schema_findings": [],
  "architecture_security_findings": [],
  "validation_summaries": [],
  "aggregate_revalidation_requirements": ["architecture", "all"],
  "recommended_review_order": [],
  "advisory_future_integration_order": [],
  "rejected_or_noneligible_outputs": ["DOC-A", "DOC-B", "DOC-C"],
  "blockers": ["Demonstration package contains no worker records."],
  "escalations": [],
  "owner_decisions_required": ["Provide verified worker records."],
  "recorded_owner_decisions": [],
  "secret_redaction_result": "applied",
  "action_audit": {
    "worker_execution_performed_by_consolidator": false,
    "files_modified_by_consolidator": false,
    "staged_by_factory": false,
    "committed_by_factory": false,
    "cherry_picked_by_factory": false,
    "merged_by_factory": false,
    "pushed_by_factory": false,
    "deployed_by_factory": false,
    "workspace_deleted_by_factory": false,
    "branch_deleted_by_factory": false
  },
  "state_history": ["pending", "blocked", "owner_review_required"],
  "created_at": "2026-07-23T12:00:00+00:00"
}
